title,authors,journal,doi,pub_date,times_cited,abstract
The natriuretic peptide/helokinestatin precursor from Mexican beaded lizard (Heloderma horridum) venom: Amino acid sequence deduced from cloned cDNA and identification of two novel encoded helokinestatins,"['Ma, CB', 'Yang, M', 'Zhou, M', 'Wu, YX', 'Wang, L', 'Chen, TB', 'Ding, AW', 'Shaw, C']",PEPTIDES,10.1016/j.peptides.2011.03.012,JUN 2011,1,"Natriuretic peptides are common components of reptile venoms and molecular cloning of their biosynthetic precursors has revealed that in snakes, they co-encode bradykinin-potentiating peptides and in venomous lizards, some co-encode bradykinin inhibitory peptides such as the helokinestatins. The common natriuretic peptide/helokinestatin precursor of the Gila Monster, Heloderma suspectum, encodes five helokinestatins of differing primary structures. Here we report the molecular cloning of a natriuretic peptide/helokinestatin precursor cDNA from a venom-derived cDNA library of the Mexican beaded lizard (Heloderma horridum). Deduction of the primary structure of the encoded precursor protein from this cloned cDNA template revealed that it consisted of 196 amino acid residues encoding a single natriuretic peptide and five helokinestatins. While the natriuretic peptide was of identical primary structure to its Gila Monster (H. suspectum) homolog, the encoded helokinestatins were not, with this region of the common precursor displaying some significant differences to its H. suspectum homolog. The helokinestatin-encoding region contained a single copy of helokinestatin-1, 2 copies of helokinestatin-3 and single copies of 2 novel peptides, (Phe)(5)-helokinestatin-2 (VPPAFVPLVPR) and helokinestatin-6 (GPPFNPPPFVDYEPR). All predicted peptides were found in reverse phase HPLC fractions of the same venom. Synthetic replicates of both novel helokinestatins were found to antagonize the relaxing effect of bradykinin on rat tail artery smooth muscle. Thus lizard venom continues to provide a source of novel biologically active peptides. (C) 2011 Published by Elsevier Inc."
"Molecular cloning of the helokinestatin/CNP precursor from a venom-derived cDNA library of the Mexican beaded lizard, Heloderma horridum, and identification of a novel encoded bradykinin-antagonist peptide, helokinestatin-6","['Chenbang, M', 'Wang, L', 'Zhou, M', 'Chen, T', 'Shaw, C']",REGULATORY PEPTIDES,10.1016/j.regpep.2010.07.160,SEP 9 2010,0,NA
GUATEMALAN BEADED LIZARD (HELODERMA HORRIDUM CHARLESBOGERTI) ON THE PACIFIC VERSANT OF GUATEMALA,"['Anzueto, RV', 'Campbell, JA']",SOUTHWESTERN NATURALIST,10.1894/GC-204.1,SEP 2010,0,We report first records of the Guatemalan headed lizard (Heloderma horridum charlesbogerti) from the Pacific versant of Guatemala. The presence of tins lizard in the region further substantiates the notion Mat this species gained access into the region through a Pacific corridor.
Conservation phylogenetics of helodermatid lizards using multiple molecular markers and a supertree approach,"['Douglas, ME', 'Douglas, MR', 'Schuett, GW', 'Beck, DD', 'Sullivan, BK']",MOLECULAR PHYLOGENETICS AND EVOLUTION,10.1016/j.ympev.2009.12.009,APR 2010,13,"We analyzed both mitochondrial (MT-) and nuclear (N) DNAs in a conservation phylogenetic framework to examine deep and shallow histories of the Beaded Lizard (Heloderma horridum) and Gila Monster (H. suspectum) throughout their geographic ranges in North and Central America. Both MTDNA and intron markers clearly partitioned each species. One intron and MTDNA further subdivided H. horridum into its four recognized subspecies (H. It. alvarezi, charlesbogerti, exasperatum, and horridum). However, the two subspecies of H. suspectum (H. s. suspectum and H. s. cinctum) were undefined. A supertree approach sustained these relationships. Overall, the Helodermatidae is reaffirmed as an ancient and conserved group. Its most recent common ancestor (MRCA) was Lower Eocene [35.4 million years ago (mya)], with a similar to 25 my period of stasis before the MRCA of H. horridum diversified in Lower Miocene. Another similar to 5 my passed before H. h. exasperatum and H. h. horridum diverged, followed by similar to 1.5 my before H. h. alvarezi and H. h. charlesbogerti separated. Heloderma suspectum reflects an even longer period of stasis (similar to 30 my) before diversifying from its MRCA. Both H. suspectum (Mexico) and H. h. alvarezi also revealed evidence of historic range expansion following a recent bottleneck. Our conservation phylogenetic approach emphasizes the origin and diversification of this group, yields information on the manner by which past environmental variance may have impacted its populations and, in turn, allows us to disentangle historic from contemporary impacts that might threaten its long-term persistence. The value of helodermatid conservation resides in natural services and medicinal products, particularly venom constituents, and these are only now being realized.. (C) 2009 Elsevier Inc. All rights reserved."
Novel Venom Proteins Produced by Differential Domain-Expression Strategies in Beaded Lizards and Gila Monsters (genus Heloderma),"['Fry, BG', 'Roelants, K', 'Winter, K', 'Hodgson, WC', 'Griesman, L', 'Kwok, HF', 'Scanlon, D', 'Karas, J', 'Shaw, C', 'Wong, L', 'Norman, JA']",MOLECULAR BIOLOGY AND EVOLUTION,10.1093/molbev/msp251,FEB 2010,29,"The origin and evolution of venom proteins in helodermatid lizards were investigated by multidisciplinary techniques. Our analyses elucidated novel toxin types resultant from three unique domain-expression processes: 1) The first full-length sequences of lethal toxin isoforms (helofensins) revealed this toxin type to be constructed by an ancestral monodomain, monoproduct gene (beta-defensin) that underwent three tandem domain duplications to encode a tetradomain, monoproduct with a possible novel protein fold; 2) an ancestral monodomain gene (encoding a natriuretic peptide) was medially extended to become a pentadomain, pentaproduct through the additional encoding of four tandemly repeated proline-rich peptides (helokinestatins), with the five discrete peptides liberated from each other by posttranslational proteolysis; and 3) an ancestral multidomain, multiproduct gene belonging to the vasoactive intestinal peptide (VIP)/glucagon family being mutated to encode for a monodomain, monoproduct (exendins) followed by duplication and diversification into two variant classes (exendins 1 and 2 and exendins 3 and 4). Bioactivity characterization of exendin and helokinestatin elucidated variable cardioactivity between isoforms within each class. These results highlight the importance of utilizing evolutionary-based search strategies for biodiscovery and the virtually unexplored potential of lizard venoms in drug design and discovery."
"New report of Mexican scorpion Heloderma horridum (Reptilia: Helodermidae) in Durango State, Mexico","['Muniz-Martinez, R', 'Rojas-Perez, MA']",REVISTA MEXICANA DE BIODIVERSIDAD,NA,DEC 2009,1,"The Beaded Mexican Reptile is one of the 2 species recognized as venomous reptiles in the world. There are known 3 subspecies of Heloderma horridum, all show a very localized distribution, along the Pacific Coast. At the Southwestern part of Durango, this species was seen at the river Presidio. One specimen of Heloderma horridum, was observed and photographed, by a group of topography technical, who donated the pictures. By using taxonomic keys, the specimen was determined as Heloderma horridum. This species is registered in NOM-ECOL-059-2001, and is considered Amazing species, so the specimen was not collected. This is new registration, broads the geographical distribution of this taxon towards the Southwestern of the Sierra Madre Occidental and its presence in Durango state, Mexico."
Envenomation by a wild Guatemalan Beaded Lizard Heloderma horridum charlesbogerti,"['Ariano-Sanchez, D']",CLINICAL TOXICOLOGY,10.1080/15563650701733031,2008,2,"Background. The Guatemalan Beaded Lizard (Heloderma horridum charlesbogerti) is an endemic venomous lizard that inhabits southeastern Guatemala. Published reports of bites by Beaded Lizard are scarce. This is the first case report of a bite from Heloderma horridum charlesbogerti. Case report. A 24-year-old man was bitten on the left hand by a juvenile Heloderma horridum charlesbogerti. The lizard remained attached for approximately 15 seconds. The patient experienced severe local pain, dizziness, diaphoresis, vomiting, severe paresthesia in his left hand and arm, and hypotension (70/52 mm/Hg). He was treated with intravenous ketorolac, chlorpheniramine, methylprednisolone, antibiotics, ondansentron, and normal saline. Hematology tests revealed leukocytosis (12,600/mm3). Symptoms improved and the patient was discharged from hospital 24 hours after admission. Conclusion. The case reported here shows that bites by Heloderma produce severe clinical effects shortly after the bite. Management consists of waiting for the lizard to relax its bite pressure and using pliers to open lizard's mouth and pull out the bitten extremity, a careful manual search for teeth remnants, and supportive care. In our case, severe pain, unresponsive to non-steroidal anti-inflammatory analgesics, was a major problem. Parethesias resolve quickly but pain may persist for up to 12 hours after the bite. A full recovery is expected."
Nucleoside composition of Heloderma venoms,"['Aird, SD']",COMPARATIVE BIOCHEMISTRY AND PHYSIOLOGY B-BIOCHEMISTRY & MOLECULAR BIOLOGY,10.1016/j.cbpb.2008.02.012,JUN 2008,1,"Venoms of Heloderma horridum and Heloderma suspectum were analyzed for the possible presence of purine and pyrimidine nucleosides. Adenosine, cytidine, guanosine, hypoxanthine, inosine, and uridine were found in mu g quantities. These amounts are much smaller than those seen in many elapid or viperine venoms, but greater and more varied than those found in crotaline venoms. While their contribution to the hypotension induced by Heloderma venoms may be minor, venom nucleosides nonetheless act in concert with kallikreins/hemorrhagins, alkaline phosphomonoesterase, 5'-nucleotidase, helodermin, helospectins, helothermine, and serotonin. The use of nucleosides as toxins is therefore a generalized squamate strategy, rather than the exclusive province of snakes. Both Heloderma venoms were found to be devoid of NADase and phosphodiesterase activities. Enzymes to release endogenous purines in the prey, are not significant components of Heloderma venoms. (c) 2008 Elsevier Inc. All rights reserved."
"Hematology, blood chemistry, and bacteriology of the free-ranging Mexican beaded lizard (Heloderma horridum)","['Espinosa-Aviles, D', 'Salomon-Soto, VM', 'Morales-Martinez, S']",JOURNAL OF ZOO AND WILDLIFE MEDICINE,10.1638/2006-0029.1,MAR 2008,7,"Blood samples from 16 adult, wild Mexican beaded lizards were obtained for complete blood count and serum biochemical analysis. In addition, both oral and cloacal swab samples were collected and submitted for bacteriologic culture. This is the first report of hematologic and bacterial data from free-living beaded lizards. This information will serve as baseline reference values for future health assessment studies in conservation, captive breeding, and research programs."
Helokinestatin: A new bradykinin B-2 receptor antagonist decapeptide from lizard venom,"['Kwok, HF', 'Chen, T', ""O'Rourke, M"", 'Ivanyi, C', 'Hirst, D', 'Shaw, C']",PEPTIDES,10.1016/j.peptides.2007.10.025,JAN 2008,9,"Synthetic bradykinin antagonist peptides/peptoids have been powerful tools for delineating the roles of kinins in both normal physiology and in pathological states. Here, we report the identification of a novel, naturally occurring bradykinin B-2 receptor antagonist peptide, helokinestatin, isolated and structurally characterized from the venoms of helodermatid lizards-the Gila monster (Heloderma suspectum) and the Mexican beaded lizard (Heloderma horridum). The primary structure of the peptide was established by a combination of microsequencing and mass spectroscopy as Gly-Pro-Pro-Tyr-Gln-Pro-Leu-Val-Pro-Arg (M-r 1122.62). A synthetic replicate of helokinestatin was found to inhibit bradykinin-induced vasorelaxation of phenylephrine pre-constricted rat tail artery smooth muscle, mediated by the B-2 receptor sub-type, in a dose-dependent manner. Natural selection, that generates functional optimization of predatory reptile venom peptides, can potentially provide new insights for drug lead design or for normal physiological or pathophysiological processes. (C) 2007 Elsevier Inc. All rights reserved."
