title,authors,journal,doi,pub_date,times_cited,abstract
Conservation status and limiting factors in the endangered population of Egyptian vulture (Neophron percnopterus) in the Canary Islands,"['Donazar, JA', 'Palacios, CJ', 'Gangoso, L', 'Ceballos, O', 'Gonzalez, MJ', 'Hiraldo, F']",BIOLOGICAL CONSERVATION,10.1016/S0006-3207(02)00049-6,SEP 2002,57,"Egyptian vulture populations have decreased sharply in the Western Palearctic: island populations are almost extinct in the Mediterranean and the Macaronesian regions. In the Canary archipelago, the species only survives in the islands of Fuerteventura and Lanzarote. During 1998-2001 we examined population parameters and evaluated some potential limiting factors for this isolated and sedentary population. The total population (breeding and non-breeding birds) was monitored annually. In addition, 26 fledglings and 33 immatures (< 6 years old) and adult birds were captured for individual marking with plastic rings. Twenty-three/twenty-four occupied territories were located in the island and the total population estimated at around 130 birds. Breeding success was lower than recorded elsewhere in the species' distribution area: only 0.43 fledglings/pair/year were produced. Adult (> 6 years old birds) and immature annual survival rates were similar, around 90%. Adult Survival was lower than expected as territorial birds seem more susceptible to poisoning. Immature survival could be favoured by the existence of regular feeding places. Casualties from power lines was the main cause of mortality (12 cases during the study period). Blood sampling revealed high frequencies of lead poisoning: 13.5 and 2.7% of individuals showed sub-clinical and clinical intoxication levels, respectively, probably caused by the ingestion of lead shot. Priority conservation measures should be directed to reduce electrocution risks, illegal poisoning, arid lead contamination. Population reinforcement with birds coining from other populations is not recommended as previous information reveals morphological and genetic differentiation of Canarian Egyptian vultures compared with continental populations. (C) 2002 Elsevier Science Ltd. All rights reserved."
Endangered Egyptian Vulture (Neophron percnopterus) entangled in a power line ground-wire stabilizer,"['Gangoso, L', 'Palacios, CJ']",JOURNAL OF RAPTOR RESEARCH,NA,SEP 2002,0,NA
Coprophagy: An unusual source of essential carotenoids - A yellow-faced vulture includes ungulate faeces in its diet for cosmetic purposes.,"['Negro, JJ', 'Grande, JM', 'Tella, JL', 'Garrido, J', 'Hornero, D', 'Donazar, JA', 'Sanchez-Zapata, JA', 'Benitez, JR', 'Barcell, M']",NATURE,10.1038/416807a,APR 25 2002,41,NA
Description of a new subspecies of the Egyptian Vulture (Accipitridae : Neophron percnopterus) from the Canary Islands,"['Donazar, JA', 'Negro, JJ', 'Palacios, CJ', 'Gangoso, L', 'Godoy, JA', 'Ceballos, O', 'Hiraldo, FN', 'Capote, N']",JOURNAL OF RAPTOR RESEARCH,NA,MAR 2002,14,"On the basis of four study skins from museum collections and 37 live birds from the island of Fuerteventura, we describe a new subspecies of the Egyptian Vulture (Neophron percnopterus majorensis) from the Canary archipelago. Canarian Egyptian Vultures are significantly larger than Western European and North African individuals. In addition, some genetic differentiation may exist; analyses of the mitochondrial DNA control region revealed that there are haplotypes exclusive to the Canary Islands. The current population of Egyptian Vultures in the Canary Islands is 25-30 breeding pairs restricted to the islands of Fuerteventura and Lanzarote, and this subspecies is therefore endangered."
Allozyme variation in four populations of African whitebacked vultures (Gyps africanus) and phylogenetic relationships between four vulture species from southern Africa,"['van Wyk, E', 'van der Bank, H', 'Verdoorn, GH']",BIOCHEMICAL SYSTEMATICS AND ECOLOGY,10.1016/S0305-1978(00)00084-3,MAY 2001,7,"Genetic variation detected by protein electrophoresis at 41 presumptive gene loci was assayed in four populations of Gyps africanus irs and compared to values previously obtained for Gyps coprotheres. Values calculated for percentage of polymorphic loci (P = 34.15%. 0.99 criterion) and average heterozygosity (H=0.108, +/- 0.032) in G. africanus, confirm low levels of genetic variation as reported for G. coprotheres. Allele frequency data, assessed at 19 loci, were obtained to evaluate generic differentiation among four vulture species. Six (31.58%) of the 19 shared loci were polymorphic. Values of 1.26 ( +/- 0.1), 26.32% and 0.076 (+/- 0.047) for G. africanus, 1.21 ( +/- 0.1). 21.05% and 0.097 ( +/- 0.045) for Torgos tracheliotus. 1.11 ( +/- 0,7), 21.05% and 0.053 ( +/- 0.053) for Neophron percnopterus and 1.05 (+/- 0.5), 5.26% and 0.044 (+/-0.047) for G. coprotheres were obtained for the mean number of alleles per locus, P and H, respectively. An average between-population fixation index (F-ST) value of 0.322 was obtained, which is indicative of significant (P<0.01) differentiation between the four accipitrid species studied. Considerable concordance was obtained between dendograms produced From different analyses, pointing to the distinctiveness of N. percnopterus, which has evolved along a separate lineage as G. africanus. G. coprotheres and T. tracheliotus. Along the latter lineage G. africanus is clustered together with G. copotheres which is consistent with the morphological similarities of these. species. <(c)> 2001 Elsevier Science Ltd. All rights reserved."
Isolation and characterization of microsatellite loci in the bearded vulture (Gypaetus barbatus) and cross-amplification in three Old World vulture species,"['Gautschi, B', 'Tenzer, I', 'Muller, JP', 'Schmid, B']",MOLECULAR ECOLOGY,10.1046/j.1365-294X.2000.105321.x,DEC 2000,118,NA
Decline of the Egyptian Vulture (Neophron percnopterus) in the Canary Islands,"['Palacios, CJ', 'Valencia, C']",JOURNAL OF RAPTOR RESEARCH,NA,MAR 2000,6,NA
"Supplemental feeding regimes for Egyptian vultures in the Negev Desert, Israel","['Meretsky, VJ', 'Mannan, RW']",JOURNAL OF WILDLIFE MANAGEMENT,10.2307/3802491,JAN 1999,15,"Supplemental feeding is increasingly used to support vulture populations threatened by declining food resources. As the practice moves from a stopgap procedure to a management technique, information is needed on the effects of variations in feeding regime on vulture behavior. We provided food to Egyptian vultures (Neophron percnopterus) in the Negev Desert, Israel, under 2 regimes. A regular feeding station (RFS) was stocked daily with 5-10 kg of chicken carcasses, and an irregular feeding station (IFS) was stocked approximately twice monthly with 20-350 kg of livestock carcasses. At the RFS, numbers peaked at 20-30 birds; flock size at the IFS peaked at 30-40 birds. Adults feeding on chickens could dominate individual carcasses and fed in higher proportions than younger birds. Large carcasses and scattered scraps at the IFS could not be defended by individuals, and adults did not feed preferentially Small, daily food deliveries favored adults and resulted in higher proportions of flocks feeding. Large, infrequent deliveries did not favor any age class; however, infrequent food deliveries may not provide sufficiently regular food for adults feeding young. Smaller competing scavengers at the RFS did not exclude Egyptian vultures from food. At the IFS, large mammals briefly excluded vultures but often improved access to food by tearing open carcasses. Eurasian griffons (Gyps fulvus) at the IFS excluded Egyptian vultures and consumed most of the available food. Eurasian griffons did not feed. on chicken carcasses; hence, small carcasses can be used to feed small vulture species preferentially when species that specialize on large carcasses are also present."
Effects of age and captivity on plasma chemistry values of the Egyptian Vulture,"['Dobado-Berrios, PM', 'Tella, JL', 'Ceballos, O', 'Donazar, JA']",CONDOR,10.2307/1369754,NOV 1998,33,"Despite the interest in blood chemistry for studying ecological and pathological characteristics of birds, sources of variability such as age and captivity are poorly understood, and reference values usually are obtained from adult captive birds. We determined 15 plasma chemical variables for 164 free-living Egyptian Vultures (Neophron percnopterus) of three age groups (nestlings, subadults, and adults), and for 9 captive adults. Free-living subadults and adults exhibited identical plasma chemistry values. Nestlings had significantly higher levels of creatinine, urate, urea, triglycerides, calcium, phosphorus, and alkaline phosphatase (AP) than both free-living subadults and adults, but lower values of glucose and aspartate aminotransferase (AST). Captive adults had significantly higher levels of total protein, albumin, creatinine, urate, cholesterol, calcium, phosphorus, and AST than free-living adults, which we attribute to differences in diet quality and physical activity. We conclude that future studies should consider age as a major source of variability in avian plasma chemistry, and that results obtained from captivity should be used cautiously to interpret plasma chemistry in the study and rehabilitation of wild birds."
